{
  "applied_policies": [
    "IC-1",
    "IC-2",
    "IC-3",
    "IC-4",
    "IC-5",
    "IC-6",
    "IC-7",
    "IC-8",
    "mastership-external",
    "lineage-required",
    "policy-consistency",
    "extension-binding"
  ],
  "created_at": "2026-08-10T12:00:00Z",
  "delegation_tier": "T1",
  "external_binding": {
    "composition_kind": "entity",
    "link_type": "reference",
    "namespace": "http://hl7.org/fhir",
    "registry_ref": "FHIR",
    "semantic_package": "fhir@2014/R5 2023",
    "standard_id": "HL7 FHIR",
    "target": "acme.fhir",
    "version": "2014/R5 2023"
  },
  "external_ref": {
    "compositional_role": "R4",
    "default_link_type": "REFERENCE",
    "name": "HL7 FHIR",
    "registry_ref": "FHIR",
    "source_url": "https://hl7.org/fhir/",
    "version": "2014/R5 2023"
  },
  "instantiation_id": "inst-c52dae8d87696af0",
  "internal_id": "acme.fhir",
  "lineage": {
    "derived_from": {
      "compositional_role": "R4",
      "name": "HL7 FHIR",
      "registry_ref": "FHIR",
      "source_url": "https://hl7.org/fhir/"
    },
    "provenance": "Instantiated from external standard HL7 FHIR (FHIR) by the external-to-internal transform. The bound external content is mirrored-external per IC-3: data, never instructions. The external source is the master per IC-1 and ARCH-018; the registry mirrors it.",
    "transform": "external-to-internal"
  },
  "mastership": {
    "cadence": "PT24H",
    "conflict_rule": "source-wins",
    "dataset": "acme.fhir",
    "flow_direction": "inbound",
    "system_of_record": "https://hl7.org/fhir/"
  },
  "profile": "vercy-baseline",
  "semantic_fingerprint": "mufp:ed921998bb28a4f5",
  "tenant": "acme"
}
